{"applied_event_ids":["graph-node-completed_6810a767f6d5fcd31d737a00","graph-node-completed_c15d803fd4302c7e4f968900","graph-node-completed_d7d7f0d8962300417b4cf81e","graph-node-completed_9f3fb946526b13b8af07e9d3"],"checkpoint_id":"checkpoint_b53e7c493f6fd00e9b2918dc","created_at":"2026-08-30T11:07:16.117909Z","event_stream_digest":"706d67ecf47730496c5866dd4cb7be07a5fb9a686651f391f8fa8f320cbbd4ee","last_sequence":4,"project_id":"project_c337b1d8836ad714616a7756","run_id":"run_fa24d20b3e1fdbc4252b7596","schema_version":"1.0","state":{"analysis.A":{},"analysis.B":{},"analysis.C":{},"artifact.A":{},"artifact.B":{"html":{"artifact_id":"artifact_a5ce5cf5132597cc00105405","candidate_artifact_digest":"f1b37ba4745997df319485fb6e929e24ed1153d0304376f6740c45fda3800381","format":"html","visual_plan_digest":"59371e3bd2707e28872b0fb425bf7c909306fecee8f41c7c6b6156842c8a43d9"}},"artifact.C":{},"download_request":{},"evidence":{},"format_artifact":{},"gate.A":{},"gate.B":{"evidence_digest":"eeae14ce581aeacc6c098cde5f45571e4d0f88d2cc5877cba5429654448381d1","failures":[],"gate_passed":true},"gate.C":{},"project":{},"qc.A":{},"qc.B":{},"qc.C":{},"qc_authorizations":{},"qc_epochs":{},"report_evidence":{},"revision_approval":{},"side_effects":{},"snapshot.A":{},"snapshot.B":{},"snapshot.C":{}},"state_digest":"b046cf2eb65cb30b502e7eb2a6aa41e578402398de86eda23520a2135f7548b6"}
