{"applied_event_ids":["graph-node-completed_f4dcc3cbff6fbafda536e6b1","graph-node-completed_eb0580ad2ac729411a425d24","graph-node-completed_b83ab3c790b7d91791ae9865","graph-node-completed_dd70372a882d0cf58ff778f8"],"checkpoint_id":"checkpoint_071bebb13011d498dd95c8da","created_at":"2026-08-30T02:15:17.561677Z","event_stream_digest":"1dcf28bf06df3853eae7d823617ebe0371a5b95d1afdc03184c7b854eb44d0a7","last_sequence":4,"project_id":"project_c337b1d8836ad714616a7756","run_id":"run_bb53d4f5480bef9bb75a2b1b","schema_version":"1.0","state":{"analysis.A":{},"analysis.B":{},"analysis.C":{},"artifact.A":{},"artifact.B":{"html":{"artifact_id":"artifact_a5ce5cf5132597cc00105405","candidate_artifact_digest":"24bf84566f7580654a828d0f1fe5bbc0fe3b5ebd8fddcccb15e3a98ceb721758","format":"html","visual_plan_digest":"34abb56051a322e272bdd2a123742f5019583a01e529bafd143df13f2f991baa"}},"artifact.C":{},"download_request":{},"evidence":{},"format_artifact":{},"gate.A":{},"gate.B":{"evidence_digest":"893b51512accb0ed1628b7c6805c8fc4d6370dd41c86bb08aca850edbf3be759","failures":[],"gate_passed":true},"gate.C":{},"project":{},"qc.A":{},"qc.B":{},"qc.C":{},"qc_authorizations":{},"qc_epochs":{},"report_evidence":{},"revision_approval":{},"side_effects":{},"snapshot.A":{},"snapshot.B":{},"snapshot.C":{}},"state_digest":"a09bb83ffbc1ec4cee5b75de2b648361eb089417608de9be13a7c79c53ecaf3a"}
